Names,state,statute_id,statute_name,estimated_amount,penalty type,year,penalty_amt_min,peanlty_amt_max,penalty_amt_fixed,other_penalty,notes
,,,,,,2009,$500 ,"$2,000 ",n/a,,Shall be sentenced to jail for a mandatory minimum period of five (5) days
,,,,,,2009,"$1,000 ","$2,000 ",n/a,,Shall be sentenced to jail for a mandatory minimum period of ten (10) days
,,,,,,2009,n/a,n/a,"$2,000 ",,
,,,,,,2009,n/a,n/a,"$5,000 ",,
Cassandra,idaho,id_197,idaho code § 49-1421a,$100 ,high occupancy vehicle lanes  penalties  definitions,2009,n/a,n/a,$100 ,,
Clark,,,,,,2010,,"$1,000 ",,,Further redefiened chapters
Nuhamin,idaho,id_76,idaho code § 18-3319a,$0 - $15000,unlawful acts  hoax destructive device,2010,n/a,n/a,"$15,000 ",imprisonment in the state prison not to exceed fifteen (15) years,
Cassandra,idaho,id_191,idaho code § 31-3201h,$10 - $100,surcharge fee,2010,$10 ,$100 ,n/a,,fee applies per infraction/misdemeanor/felony; 80% to drug/mental health court and 20% to legislative tech fund
,,,,,,2011,"$1,000 ","$3,000 ",n/a,,
,,,,,,2011,n/a,n/a,$250 ,,
,,,,,,2011,n/a,n/a,$250 ,,
,,,,,,2011,n/a,n/a,"$2,000 ",,
,,,,,,2011,n/a,n/a,"$5,000 ",,
Clark,,,,,,2012,,"$50,000 ",,$10000 for only possesion,
,,,,,,2012,n/a,n/a,n/a,"felony, imprisonment",punished by imprisonment in the state prison for a period not to exceed fifteen (15) years
,,,,,,2012,n/a,n/a,"$1,000 ",,
Cassandra,idaho,id_192,idaho code § 31-3204,$15 ,victim notification-fee,2012,n/a,n/a,$10 ,,
,,,,,,2014,n/a,n/a,$250 ,,
,,,,,,2014,n/a,n/a,"$2,000 ",,
,,,,,,2014,n/a,n/a,"$5,000 ",,
Cassandra,,,,,,2014,$9 ,$175 ,n/a,,all fees significantly increased
,,,,,,2014,n/a,n/a,$15 ,,
Cassandra,idaho,id_198,idaho code § 49-1422,$100 - $500,overtaking and passing school bus,2014,$100 ,$500 ,n/a,,
,,,,,,2015,$500 ,"$1,000 ",,misdemeanor,fine
,,,,,,2015,n/a,n/a,"$5,000 ",imprisonment in the state prison for a period of time not to exceed five (5) years,
,,,,,,2015,$150 ,"$2,500 ",n/a,could be punished by imprisonment in the county jail not exceeding six (6) months,"first conviction: $150, 2nd conviction: $300, 3rd conviction: $1001"
,,,,,,2015,$150 ,"$2,500 ",n/a,could be punished by imprisonment in the county jail not exceeding six (6) months,"first conviction: $150, 2nd conviction: $300, 3rd conviction: $1002"
,,,,,,2015,$150 ,"$1,000 ",n/a,,imprisonment in the county jail not exceeding thirty (30) days; and public service of not less than eight (8) hours and not more than forty (40) hours may be imposed 
Clark,,,,,,2016,,,,"Scaling penalty up to $1000 for first offense 2nd offense is up to $2000, up to $3000 for subsequent offenses","Record will be sealed if you have no drug related crimes within 5 years of conviction, though the defendent must innitiate it"
Clark,,,,,,2016,,,,"Scaling penalty of $300 for first offense 2nd offense is up to $2000, up to $3000 for subsequent offenses",Initial penalty lowered to 300 but is fixed
Clark,,,,,,2016,,,,$25000 for felony $1000 for misdamenor,No change(?)
Clark,,,,,,2016,,"$50,000 ",,$10000 for only possesion,Only a misdemenor if person is less than three years younger
Sreelu,idaho,id_145,idaho code § 18-7043,$0 - $10000,intentional breach of biosecurity,2016,n/a,n/a,"$10,000 ",,"shall be punished by a term of imprisonment of not more than twenty (20) years or by a fine not in excess of ten thousand dollars ($ 10,000), or by both such fine and imprisonment"
Sreelu,idaho,id_154,idaho code § 18-7907,$0 - $5000,action for protection,2016,n/a,n/a,"$5,000 ",,punishable by not to exceed one (1) year in jail
Clark,,,,,,2017,,,,Repealed,Repealed
Clark,,,,,,2018,,,,"All fines listed are their maximum. If it results is a great bodily injury it is considered a felony the fine is 10k. If not it is a misdemenor, penalty scales per offense first offense is 1k second is 2k and third beyond is 5k, fine is doubled if in presence of a child. Alternative is counciling of which the defendent will pay a resitution of all funds if goverment funds are used","Supreme court now deems who can council, and the victim now helps in deciding counciling "
,,,,,,2018,n/a,n/a,"$1,000 ",Fine and/or imprisonment,might have a jail term of not more than one (1) year
,,,,,,2018,$150 ,"$1,000 ",n/a,,
,,,,,,2018,n/a,n/a,$250 ,,
Guiselle,,,,,,2019,$50 ,"$1,500 ",n/a,n/a,"appearing to be an individual with a disability. * For the 1,500 it's for any person who, without justification intentionally interfers with the use of a service dog, or an assistance device by obstructing, battering, or intimidating the user of a device dog is guilty of a misdemeanor in the county jail not exceeding 6 months or by a fine not less than nor more than or both."
Guiselle,,,,,,2019,n/a,n/a,"$5,000 ",n/a,permits any animal that is harbored
,,,,,,2019,n/a,n/a,"$5,000 ",,
,,,,,,2019,$200 ,$600 ,n/a,,
,,,,,,2020,n/a,n/a,"$1,000 ",,could be punished by imprisonment in the county jail for a period not exceeding 6 months
,,,,,,2021,n/a,n/a,$250 ,,suspend all the defendant’s driving privileges immediately for one (1) year for a first refusal and two (2) years for a second refusal within ten (10) years 
,,,,,,2022,n/a,n/a,n/a,n/a,"The statue changed from ""18-6602 to 16601"" and it states that any person willfully marriages or enganges in sexual intercourse known to be under section 32-205, Idaho Code is guilty of a felony. Punishable up to 15 years, however if the victim is under 18 at the time of the violation, such violation is punishable by imprisonment in the state prision for a term not to exceed life."
Guiselle,idaho,id_122,idaho code § 18-6603,$0 - $300,fornication,2022,n/a,n/a,n/a,n/a,guilty of a felony if that person engages in sexual contact with human remains. Any person who violates the section may be punished by imprisonment in state prision for a term not to exceed five years.
,,,,,,2022,n/a,n/a,"$10,000 ",,
Nuhamin,idaho,id_102,idaho code § 18-5606,$1000 - $50000,accepting earnings of prostitute,2023,n/a,n/a,"$50,000 ",n/a,could be punished by imprisonment for a period of not more than twenty (20) years
Clark,,,,,,2024,,,,"All fines listed are their maximum. If it results is a great bodily injury it is considered a felony the fine is 10k. If not it is a misdemenor, penalty scales per offense first offense is 1k second is 2k and third beyond is 5k, fine is doubled if in presence of a child. Alternative is counciling of which the defendent will pay a resitution of all funds if goverment funds are used",Strangulation explicitly stated in the law
Clark,,,,,,2024,,"$50,000 ",,$10000 for only possesion,"The person must be identifiable as a child, describes the definition of it"
,,,,,,2024,n/a,n/a,"$5,000 ",fine and/or imprisonment,
,,,,,,2024,n/a,n/a,"$5,000 ",fine and/or imprisonment,
,,,,,,2024,n/a,n/a,"$5,000 ","misdemeanor, fine and/or imprisonment",
,,,,,,2024,n/a,n/a,,n/a,included new provisions including invalid and revoked licenses
,,,,,,2024,n/a,n/a,n/a,$250 ,"any minor, parent, or legal guardian who prevails in an action brought under this section may recover two hundred fifty dollars ($250) in statutory damages as well as actual damages"
,,,idaho code § 18-1517B,,children’s school and library protection,2024,n/a,n/a,n/a,$250 ,"any minor, parent, or legal guardian who prevails in an action brought under this section may recover two hundred fifty dollars ($250) in statutory damages as well as actual damages"
Nuhamin,idaho,id_97,idaho code § 18-5601,$1000 - $50000,interstate trafficking in prostitution,2024,n/a,n/a,n/a,n/a,n/a
,,,,,,2024,"$1,000 ","$50,000 ",n/a,n/a,could be punished by imprisonment for a period of no less than two (2) years and no more than twenty (20) years
,,,,,,2024,"$1,000 ","$50,000 ",n/a,n/a,could be punished by imprisonment for a period of no less than two (2) years and no more than twenty (20) years
,,,,,,2024,"$1,000 ","$50,000 ",n/a,n/a,could be punished by imprisonment for a period of no less than two (2) years and no more than twenty (20) years
,,,,,,2024,"$1,000 ","$50,000 ",n/a,n/a,could be punished by imprisonment for a period of no less than two (2) years and no more than twenty (20) years
,,,,,,2024,n/a,n/a,"$50,000 ",n/a,could be punished by imprisonment for a period of not more than twenty (20) years
Nuhamin,idaho,id_103,idaho code § 18-5607,$1000 - $50000 Na,harboring prostitutes,2024,"$1,000 ","$50,000 ",n/a,n/a,could be punished by imprisonment for a period of no less than two (2) years and no more than twenty (20) years
,,,,,,2024,"$1,000 ","$50,000 ",n/a,n/a,could be punished by imprisonment for a period of no less than two (2) years and no more than twenty (20) years
Guiselle,,,,,,2024,n/a,n/a,"$50,000 ",n/a,"every person who attemps to induce a child to engage in commerical sexual activity shall be guilty of  a felony punishable by imprisonment in the state penitentiary for a period of no more than 2 years, which may be extended to life in prision or by a fine or both."
,,,,,,2024,$300 ,"$1,000 ",n/a,,
Julia,idaho,id_50,idaho code § 18-1524,$0 - $1015,"prohibiting defacing, altering or obliterating numbers  sales prohibited  penalty",n/a,n/a,n/a,n/a,n/a,no record of this statute!
Julia,idaho,id_51,idaho code § 18-1525,$0 - $1016,unlawful use of theft detection shielding devices,n/a,n/a,n/a,n/a,n/a,no record of this statute!
Julia,idaho,id_52,idaho code § 18-1526,$0 - $1017,theft-penalties,n/a,n/a,n/a,n/a,n/a,no record of this statute!
Julia,idaho,id_53,idaho code § 18-1527,$0 - $1018,rescuing prisoners,n/a,n/a,n/a,n/a,n/a,no record of this statute!
Julia,idaho,id_54,idaho code § 18-1528,$0 - $1019,officer&#039;s assisting in escape,n/a,n/a,n/a,n/a,n/a,no record of this statute!
Julia,idaho,id_55,idaho code § 18-1529,$0 - $1020,"punishment for violation of preceding section (inmates of public institutions  enticing, aiding to escape, harboring or employing unlawful)",n/a,n/a,n/a,n/a,n/a,no record of this statute!
Julia,idaho,id_56,idaho code § 18-1530,$0 - $1021,"possession, introduction or removal of certain articles into or from correctional facilities",n/a,n/a,n/a,n/a,n/a,no record of this statute!
Julia,idaho,id_57,idaho code § 18-1531,$0 - $1022,"destruction, alteration or concealment of evidence",n/a,n/a,n/a,n/a,n/a,no record of this statute!
Julia,idaho,id_58,idaho code § 18-1532,$0 - $1023,officers not to purchase scrip,n/a,n/a,n/a,n/a,n/a,no record of this statute!
Julia,idaho,id_59,idaho code § 18-1533,$0 - $1024,making appointments for reward,n/a,n/a,n/a,n/a,n/a,no record of this statute!
Julia,idaho,id_60,idaho code § 18-1534,$0 - $1025,false imprisonment-punishment,n/a,n/a,n/a,n/a,n/a,no record of this statute!
Julia,idaho,id_61,idaho code § 18-1535,$0 - $1026,false personation,n/a,n/a,n/a,n/a,n/a,no record of this statute!
Julia,idaho,id_62,idaho code § 18-1536,$0 - $1027,intimidation by false assertion of authority,n/a,n/a,n/a,n/a,n/a,no record of this statute!
Julia,idaho,id_63,idaho code § 18-1537,$0 - $1028,"false statement by commission merchant, broker, agent, factor or consignee to principal or consignor",n/a,n/a,n/a,n/a,n/a,no record of this statute!
Julia,idaho,id_64,idaho code § 18-1538,$0 - $1029,drawing check without funds  drawing check with insufficient funds  prima facie evidence of intent  standing of person having acquired rights  probation conditions,n/a,n/a,n/a,n/a,n/a,no record of this statute!
Julia,idaho,id_65,idaho code § 18-1539,$0 - $1030,"false pretenses, cheats and misrepresentations- penalty for violation",n/a,n/a,n/a,n/a,n/a,no record of this statute!
Julia,idaho,id_66,idaho code § 18-1540,$0 - $1031,"false pretenses, cheats and misrepresentations- penalty for violation",n/a,n/a,n/a,n/a,n/a,no record of this statute!
Julia,idaho,id_67,idaho code § 18-1541,$0 - $1032,"private person stealing, mutilating or falsifying public records",n/a,n/a,n/a,n/a,n/a,no record of this statute!
Nuhamin,idaho,id_70,idaho code § 18-3302d,$5 - $1000,aiming firearms at others,n/a,n/a,n/a,n/a,n/a,n/a
Sreelu,idaho,id_157,idaho code § 18-8002a,unknown,"tests of driver for alcohol concentration, presence of drugs or other intoxicating substances  suspension upon failure of tests",n/a,n/a,n/a,n/a,,
Guiselle,,,,,,,,,,,